{
  "format": "steel-sections",
  "formatVersion": 1,
  "units": "mm",
  "label": {
    "en": "Steel — UK (BS EN)",
    "nl": "Staal — VK (BS EN)"
  },
  "families": [
    {
      "id": "ub",
      "name": {
        "en": "Universal beams (UB)",
        "nl": "UB-liggers"
      },
      "shape": "i",
      "columns": [
        "designation",
        "h",
        "b",
        "tw",
        "tf",
        "r"
      ],
      "defaultSize": "UB 305x165x40",
      "sizes": [
        [
          "UB 127x76x13",
          127,
          76,
          4,
          7.6,
          7.6
        ],
        [
          "UB 152x89x16",
          152.4,
          88.7,
          4.5,
          7.7,
          7.6
        ],
        [
          "UB 178x102x19",
          177.8,
          101.2,
          4.8,
          7.9,
          7.6
        ],
        [
          "UB 203x133x25",
          203.2,
          133.2,
          5.7,
          7.8,
          7.6
        ],
        [
          "UB 254x146x31",
          251.4,
          146.1,
          6,
          8.6,
          7.6
        ],
        [
          "UB 305x165x40",
          303.4,
          165,
          6,
          10.2,
          8.9
        ],
        [
          "UB 356x171x51",
          355,
          171.5,
          7.4,
          11.5,
          10.2
        ],
        [
          "UB 406x178x60",
          406.4,
          177.9,
          7.9,
          12.8,
          10.2
        ],
        [
          "UB 457x191x74",
          457,
          190.4,
          9,
          14.5,
          10.2
        ],
        [
          "UB 533x210x92",
          533.1,
          209.3,
          10.1,
          15.6,
          12.7
        ],
        [
          "UB 610x229x113",
          607.6,
          228.2,
          11.1,
          17.3,
          12.7
        ],
        [
          "UB 686x254x140",
          683.5,
          253.7,
          12.4,
          19,
          15.2
        ],
        [
          "UB 762x267x147",
          754,
          265.2,
          12.8,
          17.5,
          16.5
        ],
        [
          "UB 838x292x176",
          834.9,
          291.7,
          14,
          18.8,
          17.8
        ],
        [
          "UB 914x305x201",
          903,
          303.3,
          15.1,
          20.2,
          19.1
        ]
      ]
    },
    {
      "id": "uc",
      "name": {
        "en": "Universal columns (UC)",
        "nl": "UC-kolommen"
      },
      "shape": "i",
      "columns": [
        "designation",
        "h",
        "b",
        "tw",
        "tf",
        "r"
      ],
      "defaultSize": "UC 203x203x60",
      "sizes": [
        [
          "UC 152x152x23",
          152.4,
          152.2,
          5.8,
          6.8,
          7.6
        ],
        [
          "UC 152x152x30",
          157.6,
          152.9,
          6.5,
          9.4,
          7.6
        ],
        [
          "UC 203x203x46",
          203.2,
          203.6,
          7.2,
          11,
          10.2
        ],
        [
          "UC 203x203x60",
          209.6,
          205.8,
          9.4,
          14.2,
          10.2
        ],
        [
          "UC 254x254x73",
          254.1,
          254.6,
          8.6,
          14.2,
          12.7
        ],
        [
          "UC 254x254x89",
          260.3,
          256.3,
          10.3,
          17.3,
          12.7
        ],
        [
          "UC 305x305x97",
          307.9,
          305.3,
          9.9,
          15.4,
          15.2
        ],
        [
          "UC 305x305x118",
          314.5,
          307.4,
          12,
          18.7,
          15.2
        ],
        [
          "UC 356x368x153",
          362,
          370.5,
          12.3,
          20.7,
          15.2
        ],
        [
          "UC 356x406x235",
          381,
          394.8,
          18.4,
          30.2,
          15.2
        ]
      ]
    },
    {
      "id": "pfc",
      "name": {
        "en": "Parallel flange channels (PFC)",
        "nl": "PFC-profielen"
      },
      "shape": "u",
      "columns": [
        "designation",
        "h",
        "b",
        "tw",
        "tf",
        "r"
      ],
      "defaultSize": "PFC 200x90x30",
      "sizes": [
        [
          "PFC 100x50x10",
          100,
          50,
          5,
          8.5,
          9
        ],
        [
          "PFC 125x65x15",
          125,
          65,
          5.5,
          9.5,
          12
        ],
        [
          "PFC 150x75x18",
          150,
          75,
          5.5,
          10,
          12
        ],
        [
          "PFC 180x75x20",
          180,
          75,
          6,
          10.5,
          12
        ],
        [
          "PFC 200x90x30",
          200,
          90,
          7,
          14,
          12
        ],
        [
          "PFC 230x90x32",
          230,
          90,
          7.5,
          14,
          12
        ],
        [
          "PFC 260x90x35",
          260,
          90,
          8,
          14,
          12
        ],
        [
          "PFC 300x100x46",
          300,
          100,
          9,
          16.5,
          15
        ],
        [
          "PFC 380x100x54",
          380,
          100,
          9.5,
          17.5,
          15
        ],
        [
          "PFC 430x100x64",
          430,
          100,
          11,
          19,
          15
        ]
      ]
    },
    {
      "id": "uka",
      "name": {
        "en": "Angles (UKA)",
        "nl": "UKA-hoekstaal"
      },
      "shape": "angle",
      "columns": [
        "designation",
        "h",
        "b",
        "t"
      ],
      "defaultSize": "UKA 100x100x10",
      "sizes": [
        [
          "UKA 50x50x6",
          50,
          50,
          6
        ],
        [
          "UKA 60x60x6",
          60,
          60,
          6
        ],
        [
          "UKA 75x75x8",
          75,
          75,
          8
        ],
        [
          "UKA 90x90x10",
          90,
          90,
          10
        ],
        [
          "UKA 100x100x10",
          100,
          100,
          10
        ],
        [
          "UKA 120x120x12",
          120,
          120,
          12
        ],
        [
          "UKA 150x150x15",
          150,
          150,
          15
        ],
        [
          "UKA 200x200x20",
          200,
          200,
          20
        ],
        [
          "UKA 100x75x8",
          100,
          75,
          8
        ],
        [
          "UKA 150x90x12",
          150,
          90,
          12
        ]
      ]
    }
  ]
}
