{
  "format": "steel-sections",
  "formatVersion": 1,
  "units": "mm",
  "label": {
    "en": "Steel — Korea (KS D 3502)",
    "nl": "Staal — Korea (KS D 3502)"
  },
  "families": [
    {
      "id": "h-wide",
      "name": {
        "en": "H shapes — wide flange",
        "nl": "H-profielen — breedflens"
      },
      "shape": "i",
      "columns": [
        "designation",
        "h",
        "b",
        "tw",
        "tf",
        "r"
      ],
      "defaultSize": "H 300x300x10x15",
      "sizes": [
        [
          "H 100x100x6x8",
          100,
          100,
          6,
          8,
          10
        ],
        [
          "H 125x125x6.5x9",
          125,
          125,
          6.5,
          9,
          10
        ],
        [
          "H 150x150x7x10",
          150,
          150,
          7,
          10,
          11
        ],
        [
          "H 175x175x7.5x11",
          175,
          175,
          7.5,
          11,
          12
        ],
        [
          "H 200x200x8x12",
          200,
          200,
          8,
          12,
          13
        ],
        [
          "H 250x250x9x14",
          250,
          250,
          9,
          14,
          16
        ],
        [
          "H 300x300x10x15",
          300,
          300,
          10,
          15,
          18
        ],
        [
          "H 350x350x12x19",
          350,
          350,
          12,
          19,
          20
        ],
        [
          "H 400x400x13x21",
          400,
          400,
          13,
          21,
          22
        ]
      ]
    },
    {
      "id": "h-narrow",
      "name": {
        "en": "H shapes — narrow flange",
        "nl": "H-profielen — smalflens"
      },
      "shape": "i",
      "columns": [
        "designation",
        "h",
        "b",
        "tw",
        "tf",
        "r"
      ],
      "defaultSize": "H 298x149x5.5x8",
      "sizes": [
        [
          "H 100x50x5x7",
          100,
          50,
          5,
          7,
          8
        ],
        [
          "H 150x75x5x7",
          150,
          75,
          5,
          7,
          8
        ],
        [
          "H 198x99x4.5x7",
          198,
          99,
          4.5,
          7,
          11
        ],
        [
          "H 248x124x5x8",
          248,
          124,
          5,
          8,
          12
        ],
        [
          "H 298x149x5.5x8",
          298,
          149,
          5.5,
          8,
          13
        ],
        [
          "H 346x174x6x9",
          346,
          174,
          6,
          9,
          14
        ],
        [
          "H 396x199x7x11",
          396,
          199,
          7,
          11,
          16
        ],
        [
          "H 446x199x8x12",
          446,
          199,
          8,
          12,
          18
        ],
        [
          "H 496x199x9x14",
          496,
          199,
          9,
          14,
          20
        ],
        [
          "H 596x199x10x15",
          596,
          199,
          10,
          15,
          22
        ]
      ]
    }
  ]
}
