{
  "format": "steel-sections",
  "formatVersion": 1,
  "units": "mm",
  "label": {
    "en": "Steel — Brazil (W series)",
    "nl": "Staal — Brazilië (W-serie)"
  },
  "families": [
    {
      "id": "w-beams",
      "name": {
        "en": "W beams",
        "nl": "W-liggers"
      },
      "shape": "i",
      "columns": [
        "designation",
        "h",
        "b",
        "tw",
        "tf",
        "r"
      ],
      "defaultSize": "W310x32.7",
      "sizes": [
        [
          "W150x13.0",
          150,
          100,
          4.3,
          5.5,
          7
        ],
        [
          "W200x15.0",
          200,
          100,
          4.3,
          5.2,
          7
        ],
        [
          "W200x26.6",
          207,
          133,
          5.8,
          8.4,
          8
        ],
        [
          "W250x25.3",
          257,
          102,
          6.1,
          8.4,
          8
        ],
        [
          "W310x32.7",
          313,
          102,
          6.6,
          10.8,
          9
        ],
        [
          "W360x32.9",
          349,
          127,
          5.8,
          8.5,
          9
        ],
        [
          "W410x38.8",
          399,
          140,
          6.4,
          8.8,
          10
        ],
        [
          "W460x52.0",
          450,
          152,
          7.6,
          10.8,
          10
        ],
        [
          "W530x66.0",
          525,
          165,
          8.9,
          11.4,
          12
        ],
        [
          "W610x101",
          603,
          228,
          10.5,
          14.9,
          14
        ]
      ]
    },
    {
      "id": "w-columns",
      "name": {
        "en": "W columns (HP-type)",
        "nl": "W-kolommen"
      },
      "shape": "i",
      "columns": [
        "designation",
        "h",
        "b",
        "tw",
        "tf",
        "r"
      ],
      "defaultSize": "W250x73.0",
      "sizes": [
        [
          "W200x46.1",
          203,
          203,
          7.2,
          11,
          10
        ],
        [
          "W250x73.0",
          253,
          254,
          8.6,
          14.2,
          12
        ],
        [
          "W310x97.0",
          308,
          305,
          9.9,
          15.4,
          15
        ]
      ]
    }
  ]
}
