{
  "format": "steel-sections",
  "formatVersion": 1,
  "units": "mm",
  "label": {
    "en": "Steel — China (GB)",
    "nl": "Staal — China (GB)"
  },
  "families": [
    {
      "id": "hw",
      "name": {
        "en": "HW wide-flange H (GB/T 11263)",
        "nl": "HW-profielen (GB/T 11263)"
      },
      "shape": "i",
      "columns": [
        "designation",
        "h",
        "b",
        "tw",
        "tf",
        "r"
      ],
      "defaultSize": "HW 300x300",
      "sizes": [
        [
          "HW 100x100",
          100,
          100,
          6,
          8,
          10
        ],
        [
          "HW 125x125",
          125,
          125,
          6.5,
          9,
          10
        ],
        [
          "HW 150x150",
          150,
          150,
          7,
          10,
          11
        ],
        [
          "HW 200x200",
          200,
          200,
          8,
          12,
          13
        ],
        [
          "HW 250x250",
          250,
          250,
          9,
          14,
          16
        ],
        [
          "HW 300x300",
          300,
          300,
          10,
          15,
          18
        ],
        [
          "HW 350x350",
          350,
          350,
          12,
          19,
          20
        ],
        [
          "HW 400x400",
          400,
          400,
          13,
          21,
          22
        ]
      ]
    },
    {
      "id": "hm",
      "name": {
        "en": "HM middle-flange H (GB/T 11263)",
        "nl": "HM-profielen (GB/T 11263)"
      },
      "shape": "i",
      "columns": [
        "designation",
        "h",
        "b",
        "tw",
        "tf",
        "r"
      ],
      "defaultSize": "HM 294x200",
      "sizes": [
        [
          "HM 148x100",
          148,
          100,
          6,
          9,
          11
        ],
        [
          "HM 194x150",
          194,
          150,
          6,
          9,
          13
        ],
        [
          "HM 244x175",
          244,
          175,
          7,
          11,
          16
        ],
        [
          "HM 294x200",
          294,
          200,
          8,
          12,
          18
        ],
        [
          "HM 340x250",
          340,
          250,
          9,
          14,
          20
        ],
        [
          "HM 390x300",
          390,
          300,
          10,
          16,
          22
        ],
        [
          "HM 440x300",
          440,
          300,
          11,
          18,
          24
        ],
        [
          "HM 588x300",
          588,
          300,
          12,
          20,
          28
        ]
      ]
    },
    {
      "id": "hn",
      "name": {
        "en": "HN narrow-flange H (GB/T 11263)",
        "nl": "HN-profielen (GB/T 11263)"
      },
      "shape": "i",
      "columns": [
        "designation",
        "h",
        "b",
        "tw",
        "tf",
        "r"
      ],
      "defaultSize": "HN 298x149",
      "sizes": [
        [
          "HN 100x50",
          100,
          50,
          5,
          7,
          8
        ],
        [
          "HN 150x75",
          150,
          75,
          5,
          7,
          8
        ],
        [
          "HN 198x99",
          198,
          99,
          4.5,
          7,
          11
        ],
        [
          "HN 248x124",
          248,
          124,
          5,
          8,
          12
        ],
        [
          "HN 298x149",
          298,
          149,
          5.5,
          8,
          13
        ],
        [
          "HN 346x174",
          346,
          174,
          6,
          9,
          14
        ],
        [
          "HN 400x150",
          400,
          150,
          8,
          13,
          14
        ],
        [
          "HN 450x200",
          450,
          200,
          9,
          14,
          16
        ],
        [
          "HN 500x200",
          500,
          200,
          10,
          16,
          18
        ],
        [
          "HN 600x200",
          600,
          200,
          11,
          17,
          20
        ]
      ]
    },
    {
      "id": "i-beams",
      "name": {
        "en": "I-beams (GB/T 706)",
        "nl": "I-profielen (GB/T 706)"
      },
      "shape": "i",
      "columns": [
        "designation",
        "h",
        "b",
        "tw",
        "tf",
        "r"
      ],
      "defaultSize": "I20a",
      "sizes": [
        [
          "I10",
          100,
          68,
          4.5,
          7.6,
          6.5
        ],
        [
          "I12.6",
          126,
          74,
          5,
          8.4,
          7
        ],
        [
          "I14",
          140,
          80,
          5.5,
          9.1,
          7.5
        ],
        [
          "I16",
          160,
          88,
          6,
          9.9,
          8
        ],
        [
          "I18",
          180,
          94,
          6.5,
          10.7,
          8.5
        ],
        [
          "I20a",
          200,
          100,
          7,
          11.4,
          9
        ],
        [
          "I22a",
          220,
          110,
          7.5,
          12.3,
          9.5
        ],
        [
          "I25a",
          250,
          116,
          8,
          13,
          10
        ],
        [
          "I28a",
          280,
          122,
          8.5,
          13.7,
          10.5
        ],
        [
          "I32a",
          320,
          130,
          9.5,
          15,
          11.5
        ],
        [
          "I36a",
          360,
          136,
          10,
          15.8,
          12
        ],
        [
          "I40a",
          400,
          142,
          10.5,
          16.5,
          12.5
        ],
        [
          "I45a",
          450,
          150,
          11.5,
          18,
          13.5
        ]
      ]
    }
  ]
}
