{
  "format": "steel-sections",
  "formatVersion": 1,
  "units": "mm",
  "label": {
    "en": "Steel — Japan (JIS G 3192)",
    "nl": "Staal — Japan (JIS G 3192)"
  },
  "families": [
    {
      "id": "h-wide",
      "name": {
        "en": "H shapes — wide flange",
        "nl": "H-profielen — breedflens"
      },
      "shape": "i",
      "columns": [
        "designation",
        "h",
        "b",
        "tw",
        "tf",
        "r"
      ],
      "defaultSize": "H 300x300x10x15",
      "sizes": [
        [
          "H 100x100x6x8",
          100,
          100,
          6,
          8,
          10
        ],
        [
          "H 125x125x6.5x9",
          125,
          125,
          6.5,
          9,
          10
        ],
        [
          "H 150x150x7x10",
          150,
          150,
          7,
          10,
          11
        ],
        [
          "H 175x175x7.5x11",
          175,
          175,
          7.5,
          11,
          12
        ],
        [
          "H 200x200x8x12",
          200,
          200,
          8,
          12,
          13
        ],
        [
          "H 250x250x9x14",
          250,
          250,
          9,
          14,
          16
        ],
        [
          "H 300x300x10x15",
          300,
          300,
          10,
          15,
          18
        ],
        [
          "H 350x350x12x19",
          350,
          350,
          12,
          19,
          20
        ],
        [
          "H 400x400x13x21",
          400,
          400,
          13,
          21,
          22
        ]
      ]
    },
    {
      "id": "h-middle",
      "name": {
        "en": "H shapes — middle flange",
        "nl": "H-profielen — middelflens"
      },
      "shape": "i",
      "columns": [
        "designation",
        "h",
        "b",
        "tw",
        "tf",
        "r"
      ],
      "defaultSize": "H 294x200x8x12",
      "sizes": [
        [
          "H 148x100x6x9",
          148,
          100,
          6,
          9,
          11
        ],
        [
          "H 194x150x6x9",
          194,
          150,
          6,
          9,
          13
        ],
        [
          "H 244x175x7x11",
          244,
          175,
          7,
          11,
          16
        ],
        [
          "H 294x200x8x12",
          294,
          200,
          8,
          12,
          18
        ],
        [
          "H 340x250x9x14",
          340,
          250,
          9,
          14,
          20
        ],
        [
          "H 390x300x10x16",
          390,
          300,
          10,
          16,
          22
        ],
        [
          "H 440x300x11x18",
          440,
          300,
          11,
          18,
          24
        ],
        [
          "H 488x300x11x18",
          488,
          300,
          11,
          18,
          26
        ]
      ]
    },
    {
      "id": "h-narrow",
      "name": {
        "en": "H shapes — narrow flange",
        "nl": "H-profielen — smalflens"
      },
      "shape": "i",
      "columns": [
        "designation",
        "h",
        "b",
        "tw",
        "tf",
        "r"
      ],
      "defaultSize": "H 298x149x5.5x8",
      "sizes": [
        [
          "H 100x50x5x7",
          100,
          50,
          5,
          7,
          8
        ],
        [
          "H 125x60x6x8",
          125,
          60,
          6,
          8,
          9
        ],
        [
          "H 150x75x5x7",
          150,
          75,
          5,
          7,
          8
        ],
        [
          "H 175x90x5x8",
          175,
          90,
          5,
          8,
          9
        ],
        [
          "H 198x99x4.5x7",
          198,
          99,
          4.5,
          7,
          11
        ],
        [
          "H 248x124x5x8",
          248,
          124,
          5,
          8,
          12
        ],
        [
          "H 298x149x5.5x8",
          298,
          149,
          5.5,
          8,
          13
        ],
        [
          "H 346x174x6x9",
          346,
          174,
          6,
          9,
          14
        ],
        [
          "H 396x199x7x11",
          396,
          199,
          7,
          11,
          16
        ],
        [
          "H 446x199x8x12",
          446,
          199,
          8,
          12,
          18
        ],
        [
          "H 496x199x9x14",
          496,
          199,
          9,
          14,
          20
        ],
        [
          "H 596x199x10x15",
          596,
          199,
          10,
          15,
          22
        ],
        [
          "H 700x300x13x24",
          700,
          300,
          13,
          24,
          28
        ]
      ]
    },
    {
      "id": "channels",
      "name": {
        "en": "Channels",
        "nl": "U-profielen"
      },
      "shape": "u",
      "columns": [
        "designation",
        "h",
        "b",
        "tw",
        "tf",
        "r"
      ],
      "defaultSize": "[ 200x80x7.5x11",
      "sizes": [
        [
          "[ 100x50x5x7.5",
          100,
          50,
          5,
          7.5,
          8
        ],
        [
          "[ 125x65x6x8",
          125,
          65,
          6,
          8,
          8
        ],
        [
          "[ 150x75x6.5x10",
          150,
          75,
          6.5,
          10,
          10
        ],
        [
          "[ 180x75x7x10.5",
          180,
          75,
          7,
          10.5,
          11
        ],
        [
          "[ 200x80x7.5x11",
          200,
          80,
          7.5,
          11,
          12
        ],
        [
          "[ 250x90x9x13",
          250,
          90,
          9,
          13,
          14
        ],
        [
          "[ 300x90x9x13",
          300,
          90,
          9,
          13,
          14
        ],
        [
          "[ 380x100x10.5x16",
          380,
          100,
          10.5,
          16,
          18
        ]
      ]
    }
  ]
}
