{
  "format": "steel-sections",
  "formatVersion": 1,
  "units": "mm",
  "label": {
    "en": "Steel — US (AISC)",
    "nl": "Staal — VS (AISC)"
  },
  "families": [
    {
      "id": "w-shapes",
      "name": {
        "en": "W shapes (wide flange)",
        "nl": "W-profielen"
      },
      "shape": "i",
      "columns": [
        "designation",
        "h",
        "b",
        "tw",
        "tf",
        "r"
      ],
      "defaultSize": "W12x26",
      "sizes": [
        [
          "W8x31",
          203,
          203,
          7.2,
          11,
          10
        ],
        [
          "W10x33",
          247,
          202,
          7.4,
          11,
          10
        ],
        [
          "W12x26",
          310,
          165,
          5.8,
          9.7,
          9
        ],
        [
          "W12x40",
          303,
          203,
          7.5,
          13.1,
          10
        ],
        [
          "W14x30",
          352,
          171,
          6.9,
          9.8,
          10
        ],
        [
          "W14x48",
          350,
          204,
          8.6,
          15.1,
          11
        ],
        [
          "W16x40",
          407,
          178,
          7.7,
          12.8,
          10
        ],
        [
          "W18x50",
          457,
          190,
          9,
          14.5,
          11
        ],
        [
          "W21x50",
          529,
          166,
          9.7,
          13.6,
          12
        ],
        [
          "W24x68",
          603,
          228,
          10.5,
          14.9,
          12
        ],
        [
          "W27x84",
          678,
          253,
          11.7,
          16.3,
          13
        ],
        [
          "W30x90",
          750,
          264,
          11.9,
          15.5,
          13
        ],
        [
          "W33x118",
          835,
          292,
          14,
          18.7,
          15
        ],
        [
          "W36x135",
          903,
          304,
          15.2,
          20.1,
          15
        ]
      ]
    },
    {
      "id": "s-shapes",
      "name": {
        "en": "S shapes (American standard)",
        "nl": "S-profielen"
      },
      "shape": "i",
      "columns": [
        "designation",
        "h",
        "b",
        "tw",
        "tf",
        "r"
      ],
      "defaultSize": "S12x31.8",
      "sizes": [
        [
          "S6x12.5",
          152,
          85,
          5.9,
          9.1,
          8
        ],
        [
          "S8x18.4",
          203,
          102,
          6.9,
          10.8,
          9
        ],
        [
          "S10x25.4",
          254,
          118,
          7.9,
          12.5,
          10
        ],
        [
          "S12x31.8",
          305,
          127,
          8.9,
          13.8,
          11
        ],
        [
          "S15x42.9",
          381,
          140,
          10.4,
          15.8,
          12
        ],
        [
          "S18x54.7",
          457,
          152,
          11.7,
          17.6,
          13
        ],
        [
          "S20x66",
          508,
          159,
          12.8,
          20.2,
          14
        ],
        [
          "S24x80",
          610,
          178,
          12.7,
          22.1,
          15
        ]
      ]
    },
    {
      "id": "c-channels",
      "name": {
        "en": "C channels",
        "nl": "C-profielen"
      },
      "shape": "u",
      "columns": [
        "designation",
        "h",
        "b",
        "tw",
        "tf",
        "r"
      ],
      "defaultSize": "C10x15.3",
      "sizes": [
        [
          "C6x10.5",
          152,
          52,
          7.9,
          8.7,
          8
        ],
        [
          "C8x11.5",
          203,
          57,
          5.6,
          9.9,
          9
        ],
        [
          "C10x15.3",
          254,
          66,
          6.1,
          11.1,
          10
        ],
        [
          "C12x20.7",
          305,
          75,
          7.2,
          12.7,
          11
        ],
        [
          "C15x33.9",
          381,
          86,
          10.2,
          16.5,
          12
        ]
      ]
    },
    {
      "id": "l-angles",
      "name": {
        "en": "L angles",
        "nl": "L-hoekstaal"
      },
      "shape": "angle",
      "columns": [
        "designation",
        "h",
        "b",
        "t"
      ],
      "defaultSize": "L4x4x3/8",
      "sizes": [
        [
          "L2x2x1/4",
          51,
          51,
          6.4
        ],
        [
          "L3x3x1/4",
          76,
          76,
          6.4
        ],
        [
          "L3x3x3/8",
          76,
          76,
          9.5
        ],
        [
          "L4x4x3/8",
          102,
          102,
          9.5
        ],
        [
          "L4x4x1/2",
          102,
          102,
          12.7
        ],
        [
          "L5x5x1/2",
          127,
          127,
          12.7
        ],
        [
          "L6x6x1/2",
          152,
          152,
          12.7
        ],
        [
          "L6x4x3/8",
          152,
          102,
          9.5
        ],
        [
          "L8x8x3/4",
          203,
          203,
          19.1
        ]
      ]
    },
    {
      "id": "hss",
      "name": {
        "en": "HSS hollow sections",
        "nl": "HSS-kokers"
      },
      "shape": "box",
      "columns": [
        "designation",
        "h",
        "b",
        "t"
      ],
      "defaultSize": "HSS6x6x3/8",
      "sizes": [
        [
          "HSS4x4x1/4",
          102,
          102,
          6.4
        ],
        [
          "HSS5x5x1/4",
          127,
          127,
          6.4
        ],
        [
          "HSS6x6x3/8",
          152,
          152,
          9.5
        ],
        [
          "HSS8x8x3/8",
          203,
          203,
          9.5
        ],
        [
          "HSS10x10x1/2",
          254,
          254,
          12.7
        ],
        [
          "HSS6x4x1/4",
          152,
          102,
          6.4
        ],
        [
          "HSS8x4x3/8",
          203,
          102,
          9.5
        ],
        [
          "HSS8x6x3/8",
          203,
          152,
          9.5
        ],
        [
          "HSS10x6x3/8",
          254,
          152,
          9.5
        ],
        [
          "HSS12x8x1/2",
          305,
          203,
          12.7
        ]
      ]
    }
  ]
}
