{
  "format": "steel-sections",
  "formatVersion": 1,
  "units": "mm",
  "label": {
    "en": "Steel — Australia/NZ (AS/NZS 3679)",
    "nl": "Staal — Australië/NZ (AS/NZS 3679)"
  },
  "families": [
    {
      "id": "ub",
      "name": {
        "en": "Universal beams (UB)",
        "nl": "UB-liggers"
      },
      "shape": "i",
      "columns": [
        "designation",
        "h",
        "b",
        "tw",
        "tf",
        "r"
      ],
      "defaultSize": "310UB40.4",
      "sizes": [
        [
          "150UB18.0",
          155,
          75,
          6,
          9.5,
          8
        ],
        [
          "200UB25.4",
          203,
          133,
          5.8,
          7.8,
          9
        ],
        [
          "250UB31.4",
          252,
          146,
          6.1,
          8.6,
          9
        ],
        [
          "310UB40.4",
          304,
          165,
          6.1,
          10.2,
          11
        ],
        [
          "360UB50.7",
          356,
          171,
          7.3,
          11.5,
          11
        ],
        [
          "410UB59.7",
          406,
          178,
          7.8,
          12.8,
          11
        ],
        [
          "460UB74.6",
          457,
          190,
          9.1,
          14.5,
          11
        ],
        [
          "530UB92.4",
          533,
          209,
          10.2,
          15.6,
          14
        ],
        [
          "610UB113",
          607,
          228,
          11.2,
          17.3,
          14
        ]
      ]
    },
    {
      "id": "uc",
      "name": {
        "en": "Universal columns (UC)",
        "nl": "UC-kolommen"
      },
      "shape": "i",
      "columns": [
        "designation",
        "h",
        "b",
        "tw",
        "tf",
        "r"
      ],
      "defaultSize": "200UC46.2",
      "sizes": [
        [
          "100UC14.8",
          97,
          99,
          5,
          7,
          10
        ],
        [
          "150UC30.0",
          158,
          153,
          6.6,
          9.4,
          10
        ],
        [
          "200UC46.2",
          203,
          203,
          7.3,
          11,
          11
        ],
        [
          "250UC72.9",
          254,
          254,
          8.6,
          14.2,
          14
        ],
        [
          "310UC96.8",
          308,
          305,
          9.9,
          15.4,
          16
        ],
        [
          "310UC158",
          327,
          311,
          15.7,
          25,
          16
        ]
      ]
    },
    {
      "id": "pfc",
      "name": {
        "en": "Parallel flange channels (PFC)",
        "nl": "PFC-profielen"
      },
      "shape": "u",
      "columns": [
        "designation",
        "h",
        "b",
        "tw",
        "tf",
        "r"
      ],
      "defaultSize": "200PFC",
      "sizes": [
        [
          "75PFC",
          75,
          40,
          3.8,
          6.1,
          8
        ],
        [
          "100PFC",
          100,
          50,
          4.2,
          6.7,
          8
        ],
        [
          "125PFC",
          125,
          65,
          4.7,
          7.5,
          8
        ],
        [
          "150PFC",
          150,
          75,
          4.8,
          9.5,
          10
        ],
        [
          "180PFC",
          180,
          75,
          5,
          10,
          10
        ],
        [
          "200PFC",
          200,
          75,
          6,
          12,
          12
        ],
        [
          "230PFC",
          230,
          75,
          6.5,
          12,
          12
        ],
        [
          "250PFC",
          250,
          90,
          8,
          15,
          12
        ],
        [
          "300PFC",
          300,
          90,
          8,
          16,
          14
        ],
        [
          "380PFC",
          380,
          100,
          10,
          17.5,
          14
        ]
      ]
    }
  ]
}
