{
  "format": "steel-sections",
  "formatVersion": 1,
  "units": "mm",
  "label": {
    "en": "Steel — Russia (GOST)",
    "nl": "Staal — Rusland (GOST)"
  },
  "families": [
    {
      "id": "i-beams",
      "name": {
        "en": "I-beams (GOST 8239)",
        "nl": "I-balken (GOST 8239)"
      },
      "shape": "i",
      "columns": [
        "designation",
        "h",
        "b",
        "tw",
        "tf",
        "r"
      ],
      "defaultSize": "I 20",
      "sizes": [
        [
          "I 10",
          100,
          55,
          4.5,
          7.2,
          7
        ],
        [
          "I 12",
          120,
          64,
          4.8,
          7.3,
          7.5
        ],
        [
          "I 14",
          140,
          73,
          4.9,
          7.5,
          8
        ],
        [
          "I 16",
          160,
          81,
          5,
          7.8,
          8.5
        ],
        [
          "I 18",
          180,
          90,
          5.1,
          8.1,
          9
        ],
        [
          "I 20",
          200,
          100,
          5.2,
          8.4,
          9.5
        ],
        [
          "I 22",
          220,
          110,
          5.4,
          8.7,
          10
        ],
        [
          "I 24",
          240,
          115,
          5.6,
          9.5,
          10.5
        ],
        [
          "I 27",
          270,
          125,
          6,
          9.8,
          11
        ],
        [
          "I 30",
          300,
          135,
          6.5,
          10.2,
          12
        ],
        [
          "I 33",
          330,
          140,
          7,
          11.2,
          13
        ],
        [
          "I 36",
          360,
          145,
          7.5,
          12.3,
          14
        ],
        [
          "I 40",
          400,
          155,
          8.3,
          13,
          15
        ],
        [
          "I 45",
          450,
          160,
          9,
          14.2,
          16
        ],
        [
          "I 50",
          500,
          170,
          10,
          15.2,
          17
        ],
        [
          "I 55",
          550,
          180,
          11,
          16.5,
          18
        ],
        [
          "I 60",
          600,
          190,
          12,
          17.8,
          20
        ]
      ]
    },
    {
      "id": "channels",
      "name": {
        "en": "Channels (GOST 8240)",
        "nl": "U-profielen (GOST 8240)"
      },
      "shape": "u",
      "columns": [
        "designation",
        "h",
        "b",
        "tw",
        "tf",
        "r"
      ],
      "defaultSize": "U 20",
      "sizes": [
        [
          "U 5",
          50,
          32,
          4.4,
          7,
          6
        ],
        [
          "U 6.5",
          65,
          36,
          4.4,
          7.2,
          6
        ],
        [
          "U 8",
          80,
          40,
          4.5,
          7.4,
          6.5
        ],
        [
          "U 10",
          100,
          46,
          4.5,
          7.6,
          7
        ],
        [
          "U 12",
          120,
          52,
          4.8,
          7.8,
          7.5
        ],
        [
          "U 14",
          140,
          58,
          4.9,
          8.1,
          8
        ],
        [
          "U 16",
          160,
          64,
          5,
          8.4,
          8.5
        ],
        [
          "U 18",
          180,
          70,
          5.1,
          8.7,
          9
        ],
        [
          "U 20",
          200,
          76,
          5.2,
          9,
          9.5
        ],
        [
          "U 22",
          220,
          82,
          5.4,
          9.5,
          10
        ],
        [
          "U 24",
          240,
          90,
          5.6,
          10,
          10.5
        ],
        [
          "U 27",
          270,
          95,
          6,
          10.5,
          11
        ],
        [
          "U 30",
          300,
          100,
          6.5,
          11,
          12
        ]
      ]
    }
  ]
}
