{
  "format": "steel-sections",
  "formatVersion": 1,
  "units": "mm",
  "label": {
    "en": "Steel — India (IS 808)",
    "nl": "Staal — India (IS 808)"
  },
  "families": [
    {
      "id": "ismb",
      "name": {
        "en": "ISMB medium-weight beams",
        "nl": "ISMB-liggers"
      },
      "shape": "i",
      "columns": [
        "designation",
        "h",
        "b",
        "tw",
        "tf",
        "r"
      ],
      "defaultSize": "ISMB 300",
      "sizes": [
        [
          "ISMB 100",
          100,
          75,
          4,
          7.2,
          9
        ],
        [
          "ISMB 125",
          125,
          75,
          4.4,
          7.6,
          9
        ],
        [
          "ISMB 150",
          150,
          80,
          4.8,
          7.6,
          9
        ],
        [
          "ISMB 175",
          175,
          90,
          5.5,
          8.6,
          10
        ],
        [
          "ISMB 200",
          200,
          100,
          5.7,
          10.8,
          11
        ],
        [
          "ISMB 250",
          250,
          125,
          6.9,
          12.5,
          13
        ],
        [
          "ISMB 300",
          300,
          140,
          7.5,
          12.4,
          14
        ],
        [
          "ISMB 350",
          350,
          140,
          8.1,
          14.2,
          14
        ],
        [
          "ISMB 400",
          400,
          140,
          8.9,
          16,
          14
        ],
        [
          "ISMB 450",
          450,
          150,
          9.4,
          17.4,
          15
        ],
        [
          "ISMB 500",
          500,
          180,
          10.2,
          17.2,
          17
        ],
        [
          "ISMB 600",
          600,
          210,
          12,
          20.8,
          20
        ]
      ]
    },
    {
      "id": "ishb",
      "name": {
        "en": "ISHB heavy-weight beams",
        "nl": "ISHB-kolommen"
      },
      "shape": "i",
      "columns": [
        "designation",
        "h",
        "b",
        "tw",
        "tf",
        "r"
      ],
      "defaultSize": "ISHB 300",
      "sizes": [
        [
          "ISHB 150",
          150,
          150,
          5.4,
          9,
          8
        ],
        [
          "ISHB 200",
          200,
          200,
          6.1,
          9,
          9
        ],
        [
          "ISHB 225",
          225,
          225,
          6.5,
          9.1,
          10
        ],
        [
          "ISHB 250",
          250,
          250,
          6.9,
          9.7,
          10
        ],
        [
          "ISHB 300",
          300,
          250,
          7.6,
          10.6,
          11
        ],
        [
          "ISHB 350",
          350,
          250,
          8.3,
          11.6,
          12
        ],
        [
          "ISHB 400",
          400,
          250,
          9.1,
          12.7,
          14
        ],
        [
          "ISHB 450",
          450,
          250,
          9.8,
          13.7,
          15
        ]
      ]
    },
    {
      "id": "ismc",
      "name": {
        "en": "ISMC channels",
        "nl": "ISMC-profielen"
      },
      "shape": "u",
      "columns": [
        "designation",
        "h",
        "b",
        "tw",
        "tf",
        "r"
      ],
      "defaultSize": "ISMC 200",
      "sizes": [
        [
          "ISMC 100",
          100,
          50,
          4.7,
          7.5,
          9
        ],
        [
          "ISMC 150",
          150,
          75,
          5.4,
          9,
          10
        ],
        [
          "ISMC 200",
          200,
          75,
          6.1,
          11.4,
          11
        ],
        [
          "ISMC 250",
          250,
          80,
          7.1,
          14.1,
          12
        ],
        [
          "ISMC 300",
          300,
          90,
          7.6,
          13.6,
          13
        ],
        [
          "ISMC 400",
          400,
          100,
          8.6,
          15.3,
          15
        ]
      ]
    },
    {
      "id": "isa",
      "name": {
        "en": "ISA angles",
        "nl": "ISA-hoekstaal"
      },
      "shape": "angle",
      "columns": [
        "designation",
        "h",
        "b",
        "t"
      ],
      "defaultSize": "ISA 100x100x10",
      "sizes": [
        [
          "ISA 50x50x6",
          50,
          50,
          6
        ],
        [
          "ISA 65x65x6",
          65,
          65,
          6
        ],
        [
          "ISA 75x75x8",
          75,
          75,
          8
        ],
        [
          "ISA 90x90x8",
          90,
          90,
          8
        ],
        [
          "ISA 100x100x10",
          100,
          100,
          10
        ],
        [
          "ISA 130x130x12",
          130,
          130,
          12
        ],
        [
          "ISA 150x150x16",
          150,
          150,
          16
        ],
        [
          "ISA 200x200x20",
          200,
          200,
          20
        ],
        [
          "ISA 100x75x8",
          100,
          75,
          8
        ],
        [
          "ISA 150x90x12",
          150,
          90,
          12
        ]
      ]
    }
  ]
}
